{"epoch":"g64","forms":["0F10","0F11","0F18","0F19","0F12","0F13","0F1A","0F1B","0F14","0F15","0F1C","0F1D","0F16","0F17","0F1E","0F1F"],"phase":"bit_operations","schema":"vaeg-upd9002-m64-phase-audit-v1","schema_version":1,"source_sha":"99c6388df903dfc69432730cc9fa908a83946774","summaries":{"0F10":{"architectural_failure_count":0,"architectural_failure_hash_set_sha256":"4f53cda18c2baa0c0354bb5f9a3ecbe5ed12ab4d8e11ba873c2f11161202b945","architectural_pass_count":5000,"architectural_pass_hash_set_sha256":"e6a04a62e9801164c63d9165940691cf68ed886c8c49a3457e36ee03494d7419","classification_counts":{"applicable":5000},"executed_by_worker":5000,"record_hash_set_sha256":"e6a04a62e9801164c63d9165940691cf68ed886c8c49a3457e36ee03494d7419","selected":5000},"0F11":{"architectural_failure_count":0,"architectural_failure_hash_set_sha256":"4f53cda18c2baa0c0354bb5f9a3ecbe5ed12ab4d8e11ba873c2f11161202b945","architectural_pass_count":5000,"architectural_pass_hash_set_sha256":"4f2b2689fb3a1d928f3d9e7677376cd537004331e1d1a6a6936091425c25e368","classification_counts":{"applicable":5000},"executed_by_worker":5000,"record_hash_set_sha256":"4f2b2689fb3a1d928f3d9e7677376cd537004331e1d1a6a6936091425c25e368","selected":5000},"0F12":{"architectural_failure_count":0,"architectural_failure_hash_set_sha256":"4f53cda18c2baa0c0354bb5f9a3ecbe5ed12ab4d8e11ba873c2f11161202b945","architectural_pass_count":5000,"architectural_pass_hash_set_sha256":"61a3d0ce14934f503899c9164ae56d546252240bac660a10468ab39a8700f022","classification_counts":{"applicable":5000},"executed_by_worker":5000,"record_hash_set_sha256":"61a3d0ce14934f503899c9164ae56d546252240bac660a10468ab39a8700f022","selected":5000},"0F13":{"architectural_failure_count":0,"architectural_failure_hash_set_sha256":"4f53cda18c2baa0c0354bb5f9a3ecbe5ed12ab4d8e11ba873c2f11161202b945","architectural_pass_count":5000,"architectural_pass_hash_set_sha256":"97115cc1d34a369101c7ec9915769ba6e32c89c34f1b0fb3628cda05353f48f8","classification_counts":{"applicable":5000},"executed_by_worker":5000,"record_hash_set_sha256":"97115cc1d34a369101c7ec9915769ba6e32c89c34f1b0fb3628cda05353f48f8","selected":5000},"0F14":{"architectural_failure_count":0,"architectural_failure_hash_set_sha256":"4f53cda18c2baa0c0354bb5f9a3ecbe5ed12ab4d8e11ba873c2f11161202b945","architectural_pass_count":5000,"architectural_pass_hash_set_sha256":"3324bf3d97c8e6f4ffdb2553cf6a0dba0e4c0e148d54746addc810535438a254","classification_counts":{"applicable":5000},"executed_by_worker":5000,"record_hash_set_sha256":"3324bf3d97c8e6f4ffdb2553cf6a0dba0e4c0e148d54746addc810535438a254","selected":5000},"0F15":{"architectural_failure_count":0,"architectural_failure_hash_set_sha256":"4f53cda18c2baa0c0354bb5f9a3ecbe5ed12ab4d8e11ba873c2f11161202b945","architectural_pass_count":5000,"architectural_pass_hash_set_sha256":"5767dec4e3aec8e9458354d175fa8933c87667e67b0c2c171de8754d525c33a0","classification_counts":{"applicable":5000},"executed_by_worker":5000,"record_hash_set_sha256":"5767dec4e3aec8e9458354d175fa8933c87667e67b0c2c171de8754d525c33a0","selected":5000},"0F16":{"architectural_failure_count":0,"architectural_failure_hash_set_sha256":"4f53cda18c2baa0c0354bb5f9a3ecbe5ed12ab4d8e11ba873c2f11161202b945","architectural_pass_count":5000,"architectural_pass_hash_set_sha256":"f9d15ee060047e5e1e9cb47ce9322eefe39e017cc3bf8b228649035e79412d30","classification_counts":{"applicable":5000},"executed_by_worker":5000,"record_hash_set_sha256":"f9d15ee060047e5e1e9cb47ce9322eefe39e017cc3bf8b228649035e79412d30","selected":5000},"0F17":{"architectural_failure_count":0,"architectural_failure_hash_set_sha256":"4f53cda18c2baa0c0354bb5f9a3ecbe5ed12ab4d8e11ba873c2f11161202b945","architectural_pass_count":5000,"architectural_pass_hash_set_sha256":"59e2a36455d8c5a5b2811603177da0d3c6ea40b584f0d3b468eb0021a1d262ca","classification_counts":{"applicable":5000},"executed_by_worker":5000,"record_hash_set_sha256":"59e2a36455d8c5a5b2811603177da0d3c6ea40b584f0d3b468eb0021a1d262ca","selected":5000},"0F18":{"architectural_failure_count":0,"architectural_failure_hash_set_sha256":"4f53cda18c2baa0c0354bb5f9a3ecbe5ed12ab4d8e11ba873c2f11161202b945","architectural_pass_count":5000,"architectural_pass_hash_set_sha256":"7039cccbbb1bcc3890c407b65029ad8f476da0d3e98ad802d60634a1307c1b6c","classification_counts":{"applicable":5000},"executed_by_worker":5000,"record_hash_set_sha256":"7039cccbbb1bcc3890c407b65029ad8f476da0d3e98ad802d60634a1307c1b6c","selected":5000},"0F19":{"architectural_failure_count":0,"architectural_failure_hash_set_sha256":"4f53cda18c2baa0c0354bb5f9a3ecbe5ed12ab4d8e11ba873c2f11161202b945","architectural_pass_count":5000,"architectural_pass_hash_set_sha256":"74ca131ffc43a1ab5535810ce1aa5141612edb7d9dc8cd8869baabea558e09d6","classification_counts":{"applicable":5000},"executed_by_worker":5000,"record_hash_set_sha256":"74ca131ffc43a1ab5535810ce1aa5141612edb7d9dc8cd8869baabea558e09d6","selected":5000},"0F1A":{"architectural_failure_count":0,"architectural_failure_hash_set_sha256":"4f53cda18c2baa0c0354bb5f9a3ecbe5ed12ab4d8e11ba873c2f11161202b945","architectural_pass_count":5000,"architectural_pass_hash_set_sha256":"23218d7d58981ab846e95f94196f827eb218a2c472bcd85bae12d1f7c2e13c5d","classification_counts":{"applicable":5000},"executed_by_worker":5000,"record_hash_set_sha256":"23218d7d58981ab846e95f94196f827eb218a2c472bcd85bae12d1f7c2e13c5d","selected":5000},"0F1B":{"architectural_failure_count":0,"architectural_failure_hash_set_sha256":"4f53cda18c2baa0c0354bb5f9a3ecbe5ed12ab4d8e11ba873c2f11161202b945","architectural_pass_count":5000,"architectural_pass_hash_set_sha256":"8eedcbf420195f152b0173b1d74dd5ee36dbbbc2d10bf63dc12cf6c0c0bfa90e","classification_counts":{"applicable":5000},"executed_by_worker":5000,"record_hash_set_sha256":"8eedcbf420195f152b0173b1d74dd5ee36dbbbc2d10bf63dc12cf6c0c0bfa90e","selected":5000},"0F1C":{"architectural_failure_count":0,"architectural_failure_hash_set_sha256":"4f53cda18c2baa0c0354bb5f9a3ecbe5ed12ab4d8e11ba873c2f11161202b945","architectural_pass_count":5000,"architectural_pass_hash_set_sha256":"c278d4f16253ee48706ff5b622cc563bb69544f5a8f51de630ad14b3a80b5087","classification_counts":{"applicable":5000},"executed_by_worker":5000,"record_hash_set_sha256":"c278d4f16253ee48706ff5b622cc563bb69544f5a8f51de630ad14b3a80b5087","selected":5000},"0F1D":{"architectural_failure_count":0,"architectural_failure_hash_set_sha256":"4f53cda18c2baa0c0354bb5f9a3ecbe5ed12ab4d8e11ba873c2f11161202b945","architectural_pass_count":5000,"architectural_pass_hash_set_sha256":"2c878fccc1a7e603337809d016ae50e7a8729dc6e68f16e9f4e4066110d6cc72","classification_counts":{"applicable":5000},"executed_by_worker":5000,"record_hash_set_sha256":"2c878fccc1a7e603337809d016ae50e7a8729dc6e68f16e9f4e4066110d6cc72","selected":5000},"0F1E":{"architectural_failure_count":0,"architectural_failure_hash_set_sha256":"4f53cda18c2baa0c0354bb5f9a3ecbe5ed12ab4d8e11ba873c2f11161202b945","architectural_pass_count":5000,"architectural_pass_hash_set_sha256":"1af77460af220474bad5340588872a1388b29500b379ed79b506ce033c89fd00","classification_counts":{"applicable":5000},"executed_by_worker":5000,"record_hash_set_sha256":"1af77460af220474bad5340588872a1388b29500b379ed79b506ce033c89fd00","selected":5000},"0F1F":{"architectural_failure_count":0,"architectural_failure_hash_set_sha256":"4f53cda18c2baa0c0354bb5f9a3ecbe5ed12ab4d8e11ba873c2f11161202b945","architectural_pass_count":5000,"architectural_pass_hash_set_sha256":"041e26351c3dabae69d7d62805f235f7de93ef695195826b61e470eb5a784b1e","classification_counts":{"applicable":5000},"executed_by_worker":5000,"record_hash_set_sha256":"041e26351c3dabae69d7d62805f235f7de93ef695195826b61e470eb5a784b1e","selected":5000}},"worker_sha256":"5611c26224fd060dfdcaaca02ed3a57ce9e30156d8617eaca2d9a6fd9f593199"}
