{"epoch":"g64","forms":["0FFF"],"phase":"brkem","schema":"vaeg-upd9002-m64-phase-audit-v1","schema_version":1,"source_sha":"99c6388df903dfc69432730cc9fa908a83946774","summaries":{"0FFF":{"compatibility_scope":"no_v20_sst_cases","executed":0,"record_hash_set_sha256":"4f53cda18c2baa0c0354bb5f9a3ecbe5ed12ab4d8e11ba873c2f11161202b945","selected":0,"silicon_mode_identity":"underdetermined","sst_contract_status":"not_yet_present"}},"worker_sha256":"5611c26224fd060dfdcaaca02ed3a57ce9e30156d8617eaca2d9a6fd9f593199"}
